[
  {
    "id": "test-chevening-scholarship",
    "title_ar": "[تجريبي] منحة تشيفنينغ للدراسات العليا في بريطانيا",
    "title_en": "[Test] Chevening Master's Scholarship in the UK",
    "organization": "[تجريبي] وزارة الخارجية والتنمية البريطانية (FCDO)",
    "category": "Scholarship",
    "field": "جميع التخصصات الأكاديمية",
    "country": "المملكة المتحدة",
    "coverage": "ممولة بالكامل (شاملة الرسوم وتكاليف المعيشة)",
    "deadline": "2026-11-20",
    "official_url": "https://www.chevening.org/scholarships/",
    "verification_date": "2026-10-15",
    "eligibility_ar": "مفتوحة لخريجي البكالوريوس مع عامين من الخبرة العملية والعودة لليمن بعد التخرج.",
    "eligibility_en": "Open to undergraduate degree holders with at least two years of work experience."
  },
  {
    "id": "test-google-ai-course",
    "title_ar": "[تجريبي] البرنامج التأسيسي لتعليم الذكاء الاصطناعي وبايثون",
    "title_en": "[Test] Google Foundation in AI and Python Programming",
    "organization": "[تجريبي] مهارات Google للشرق الأوسط",
    "category": "Course",
    "field": "علوم الحاسوب والذكاء الاصطناعي",
    "country": "عبر الإنترنت (Online)",
    "coverage": "مجاني بالكامل مع شهادة إتمام رقمية",
    "deadline": "Rolling",
    "official_url": "https://grow.google/intl/ar_mena/",
    "verification_date": "2026-10-15",
    "eligibility_ar": "متاح للجميع دون شروط مسبقة أو متطلبات أكاديمية معقدة.",
    "eligibility_en": "Open to all students and beginners with no mandatory prerequisites."
  },
  {
    "id": "test-undp-internship",
    "title_ar": "[تجريبي] تدريب مهني في تحليل البيانات والتنمية المستدامة",
    "title_en": "[Test] UNDP Data Analytics & Sustainable Development Internship",
    "organization": "[تجريبي] برنامج الأمم المتحدة الإنمائي (UNDP)",
    "category": "Internship",
    "field": "تحليل البيانات والعلوم التنموية",
    "country": "اليمن (صنعاء / عدن أو عن بُعد)",
    "coverage": "مكافأة شهرية لتغطية المواصلات وبدل التدريب",
    "deadline": "2026-10-22",
    "official_url": "https://www.undp.org/careers",
    "verification_date": "2026-10-15",
    "eligibility_ar": "للطلبة في سنتهم الجامعية الأخيرة أو الخريجين الجدد في تخصصات الإحصاء وتقنية المعلومات.",
    "eligibility_en": "Final year students or recent graduates in IT, Statistics, or related areas."
  },
  {
    "id": "test-daad-expired-scholarship",
    "title_ar": "[تجريبي] منحة داد للدراسات العليا في الهندسة",
    "title_en": "[Test] DAAD Master's Degree Scholarships for Development",
    "organization": "[تجريبي] الهيئة الألمانية للتبادل الثقافي (DAAD)",
    "category": "Scholarship",
    "field": "الهندسة والعلوم التطبيقية",
    "country": "ألمانيا",
    "coverage": "ممولة بالكامل بما في ذلك التأمين وتذاكر السفر",
    "deadline": "2024-03-31",
    "official_url": "https://www.daad.de/en/",
    "verification_date": "2026-10-15",
    "eligibility_ar": "حاصل على البكالوريوس بتقدير جيد جداً مع سنتين خبرة مهنية في المجال.",
    "eligibility_en": "Bachelor degree with above-average grades and minimum 2 years work experience."
  },
  {
    "id": "test-edx-cs50-course",
    "title_ar": "[تجريبي] مقدمة علوم الحاسوب والبرمجة بجامعة هارفارد",
    "title_en": "[Test] CS50: Introduction to Computer Science by Harvard",
    "organization": "[تجريبي] منصة edX / جامعة هارفارد",
    "category": "Course",
    "field": "علوم الحاسوب والذكاء الاصطناعي",
    "country": "عبر الإنترنت (Online)",
    "coverage": "محتوى مجاني بالكامل (رسوم الشهادة مدعومة بدعم مالي)",
    "deadline": "Rolling",
    "official_url": "https://www.edx.org/course/cs50s-introduction-to-computer-science",
    "verification_date": "2026-10-15",
    "eligibility_ar": "مفتوح للجميع حول العالم مع توفر اتصال بالإنترنت وحاسوب شخصي.",
    "eligibility_en": "Open to learners worldwide with basic computer literacy and internet access."
  },
  {
    "id": "test-remote-frontend-internship",
    "title_ar": "[تجريبي] تدريب عملي في تطوير واجهات الويب الأمامية",
    "title_en": "[Test] Remote Frontend Web Development Internship",
    "organization": "[تجريبي] حاضنة تقنية المعلومات الإقليمية (MENA Tech Hub)",
    "category": "Internship",
    "field": "تطوير البرمجيات وتصميم المواقع",
    "country": "عن بُعد (Remote)",
    "coverage": "تدريب مدفوع مع إشراف مهني مباشر وشهادة خبرة",
    "deadline": "2026-10-20",
    "official_url": "https://example.org/mena-tech-internship",
    "verification_date": "2026-10-15",
    "eligibility_ar": "إتقان أساسيات HTML وCSS وJavaScript والالتزام بـ 20 ساعة أسبوعياً.",
    "eligibility_en": "Proficiency in modern HTML, CSS, JavaScript; 20 hours per week commitment."
  },
  {
    "id": "test-turkey-burslari-scholarship",
    "title_ar": "[تجريبي] المنحة التركية للبكالوريوس والدراسات العليا",
    "title_en": "[Test] Türkiye Scholarships for International Students",
    "organization": "[تجريبي] رئاسة أتراك المهجر والمجتمعات ذات القربى (YTB)",
    "category": "Scholarship",
    "field": "الطب والعلوم الصحية",
    "country": "تركيا",
    "coverage": "ممولة بالكامل مع سنة تحضيرية للغة التركية وسكن جامعي",
    "deadline": "2026-12-15",
    "official_url": "https://www.turkiyeburslari.gov.tr/",
    "verification_date": "2026-10-15",
    "eligibility_ar": "معدل تراكمي لا يقل عن 85% للتخصصات الصحية والطبية والسن أقل من 25 عاماً.",
    "eligibility_en": "Minimum 85% academic GPA for medical sciences and age under 25 for undergraduate."
  },
  {
    "id": "test-who-public-health-course",
    "title_ar": "[تجريبي] مساق إدارة الأزمات الصحية وطب الطوارئ",
    "title_en": "[Test] WHO Health Emergencies and Crisis Response Course",
    "organization": "[تجريبي] منظمة الصحة العالمية (OpenWHO)",
    "category": "Course",
    "field": "الطب والعلوم الصحية",
    "country": "عبر الإنترنت (Online)",
    "coverage": "مجاني بالكامل مع شهادة رقمية معتمدة",
    "deadline": "Rolling",
    "official_url": "https://openwho.org/",
    "verification_date": "2026-10-15",
    "eligibility_ar": "موجه للعاملين في القطاع الطبي والصحي وطلاب كليات الطب والتمريض.",
    "eligibility_en": "Targeted at healthcare professionals, medical students, and emergency workers."
  }
]
